Dimension,ASIN,Date_First_Available,Manufacturer,Store,Country_of_Origin,Best_Sellers_Rank,Color,Item_Model_Number,Item_Weight,Price,Amazon_Global_Shipping,Estimated_Import_Charges,Description,5-star,4-star,3-star,2-star,1-star
13.77 x 10.6 x 5.51 inches,B0DKNPJMMH,None,BXYD001,Brand: GEMLORD,None,None,None,BXYD-001,None,$26.99,None,None,"['Sufficient Quantity: This pack includes 100 oil absorbent mats, providing you with ample quantity to meet your various needs. Whether for frequent spills or backup replacements, these mats are designed to handle multiple cleanups efficiently.', 'High-Quality Material: Made from premium filter cotton, these mats feature excellent oil and water absorption capabilities. They are engineered to absorb liquids quickly, providing an efficient and reliable solution for cleaning up oil, grease, and other spills with ease.', 'Perfect Size: Each mat measures approximately 25 x 33 cm (9.8 x 13 inches), making them the perfect size for wiping down tools, machinery, car parts, or serving as a protective mat for garage floors, workstations, or countertops. They’re large enough to cover a broad area while remaining easy to handle.', 'Convenient & Easy to Use: No tools are required—simply place the mat where needed to absorb oil and other spills. The mats are disposable, meaning you won’t have to spend time cleaning them. For customized use, they can be easily cut to the size you need, helping you maintain a clean and tidy workspace effortlessly.', ""Wide Range of Applications:These absorbent mats are ideal for use in garages, workshops, kitchens, industrial settings, basements, and more. Whether you're dealing with oil, water, or other liquid spills, these mats provide versatile, reliable performance in various environments.""]",0%,0%,0%,0%,0%
15.75 x 12.6 x 3.94 inches,B0DMP3K3KJ,None,Heigble,Brand: Heigble,None,None,Pink,None,None,$27.99,None,None,"['Package Includes: each package of our bilge oil boom comprises 4 bilge absorbent oils, providing a plentiful supply; The number is enough to cater to your needs for a significant period', ""Material Composition: our absorbent oil is crafted from polypropylene, ensuring absorption ability; It keeps ship's bilge clean; It is easy to be installed and applied due to its convenient fixating function, deterring potential for equipment disruption"", 'Product Size: with a size of about 11.81 x 3.94 inches/ 30 x 10 cm, the oil absorbent sheets ensure practicality during usage; Its optimal dimensions ensure thorough cleaning and absorption within the bilge', 'Reusable Function: these oil absorbent pads are thoughtfully designed to be reusable; After being fully saturated with oil, you can easily manually wring them out and reuse them approximately 4–6 times, adding value through their extended lifespan', 'Absorption Capacity: designed for absorption, this bilge absorbent oil catches oils and fats up to 2 quarts while repelling water; As an effective oil spill cleaner, thus ensuring a pristine']",0%,0%,0%,0%,0%
15.5 x 12 x 12 inches,B0CV4MLVZ8,None,PRIMAW325,Prime Guard Store,None,None,None,AW325,None,$85.24,None,None,"['Provides anti-wear protection', 'Inhibits rust & corrosion', 'Anti foaming agent']",0%,0%,0%,0%,0%
9.45 x 7.95 x 6.26 inches,B0DPXT9XCQ,None,00205-6PK,BlueDevil Products Store,None,None,None,None,None,$137.65,None,None,"['Permanent repair for radiator and block leaks.', 'Works effectively on plastic, aluminum and/or metal radiators', 'Contains no solids or fibrous materials.', 'Safe and Easy to use.']",67,12,7,4,10
7.52 x 7.2 x 1.1 inches,B0DN1M8B12,None,REWMPN12,Brand: JawGrew,None,None,None,REWRG606BL-30PS,None,$4.49,None,None,"['Rubber Material: This windshield washer hose set is made of rubber material. Its excellent toughness and elasticity can be used perfectly in different environments without affecting the water jet. Flexible, wear-resistant and durable, with long service life. The hose connector is made of plastic material, which is impact-resistant and not easy to break.', 'Perfect Replacement: This windshield washer hose kit can help you replace the aged hose easily and quickly, and correctly connect the water pump to the windshield nozzle. It makes you more efficient when cleaning your car glass, thus providing you with convenience.', 'Easy to Use: This glass washer hose quickly sprays and cleans the windshield, restoring a clear view for you, which helps driving safety. At the same time, it can effectively extend the life of wiper blades.', 'Widely Used: The sizes of the three connectors are T-type 1.34 "" x 0.8 "", I-type 1.3 "", and Y-type 1.4 "" x 1 "". This windshield wiper hose repair kit is suitable for most windshield washer nozzles. It is widely used in cars, SUVs, trucks, etc.', 'Packing List: You will receive 1 x 13.1 Ft windshield washer hose and 30 hose connectors, including 10 Y-shapes, 10 I-shapes and 10 T-shapes. Sufficient quantity to meet your use and replacement needs, no need to worry about the damaged connector affecting the use of the cleaning wipers.']",100,0%,0%,0%,0%
4 x 4 x 1.9 inches,B0DHRYCQG6,None,Replace Q78AB9DBTWA,Brand: ULZOZN,None,None,None,Front Hub Grease Cap,None,$19.88,None,None,"['Perfect Fit: Replace 43514-28010, fit for TOYOTA 4Runner 1996-2021 FJ Cruiser 2007-2014 Previa 1991-1997 Sequoia 2001-2007 Tacoma 1995-2021 Tundra 2000-2006, fit for LEXUS GX460 2010 - 2021 GX470 2003-2009', 'Efficient Sealing: The front wheel hub grease cover effectively prevents dust, moisture, and other impurities from entering the hub bearings, ensuring the cleanliness and lubrication of the bearings and maintaining optimal driving performance', 'Durable and Sturdy: Made of high-quality materials, corrosion-resistant and wear-resistant, and subjected to strict quality testing, it can be used for a long time in harsh environments, making it easy to cope with', 'Maintain Lubrication: The sealed design can keep the grease inside the bearing, reduce wear, extend the service life of the bearing, maintain good lubrication of the bearing, and improve the handling and stability of the vehicle', 'Easy Installation: You will get 2 x Front hub grease caps, which can be replaced directly, making it easy and fast to install, bringing you great convenience']",0%,0%,0%,0%,0%
10.35 x 9.33 x 8.23 inches,B0DLZWGDMT,None,RT-1525,LIIZOUSUDA Store,None,None,None,RT-1525,None,$93.99,None,None,"['PROFESSIONAL INDUSTRIAL STRENGTH – This high-temperature rtv gasket sealant is designed to withstand the harsh conditions of industrial environments, making it designed specially for high-torque and high-vibration applications. Resists oil, water, anti-freeze, and transmission fluid.', 'TOUGH & FLEXIBLE – Once dry, the silicone gasket maker forms a seal that resists cracking, shrinking, and migration caused by thermal cycling, vibration, and contraction. Maximum vibration resistance, with outstanding resistance to oils, cooling, and shop fluids.', 'HIGH TEMPERATURE AND LONG LASTING – RTV gasket maker cures without shrinking and has a low odor and non-corrosive formula. Temperature range -65°F to +550°F Int. (-54°C to +260°C) intermittent, making it ideal for use in automotive, industrial, and other high-heat applications.', 'MULTIFUNCTIONAL RTV SILICONE GASKET MAKER – Ideal for replacing gaskets on cam or transmission covers, thermostat housings, intake manifold seals, oil pans, and water pumps, guaranteed not to leak.', 'PACKAGE CONTAIN – 12 pcs 13 oz. High-Temp Gasket Maker RTV Silicone.']",100,0%,0%,0%,0%
7.4 x 5.71 x 0.55 inches; 4 ounces,B0DQ5GWN37,None,Generic,Brand: Generic,None,None,None,None,None,$9.99,None,None,"['✨ Professional Cleaning Tool Kit: Our carburetor cleaning kit includes 4 cleaning wires, 8 precision needles, and 3 double-ended brushes. This welding tip cleaner set effectively removes clogs from carburetors and torch tips, perfect for comprehensive carburetor maintenance and torch tip cleaning', '🔄 Durable & Reusable: This professional carburetor cleaner kit is designed for multiple uses, efficiently removing debris from carb jets and small passages. Perfect for cleaning clogged natural gas/propane jets and engine carburetors, ensuring long-lasting performance', '💫 Simple & Effective Design: The specialized torch tip cleaner features a spiral design, specifically engineered for unclogging cutting nozzles from welding residue. Regular maintenance with our carb cleaning tools extends nozzle life and ensures optimal performance', '🛠️ Premium Quality Construction: Our carburetor cleaning tools combine high-density nylon brushes with professional-grade stainless steel. The durable materials resist rust and deformation, while spiral bristles ensure thorough cleaning of your carburetor and welding tips', '👥 Versatile Applications: This universal carburetor cleaner kit works perfectly on spray guns, nozzles, and pneumatic tools. Ideal for cars, motorcycles, ATVs, welding machines, camping stoves, tattoo equipment, lawn machinery, and various small engine carburetors']",60,40,0%,0%,0%
11.06 x 10.39 x 8.43 inches,B0DPXZTYVD,None,BDEV0021212,BlueDevil Products Store,None,None,None,00212-12PK,None,$470.64,None,None,"['Permanent repair for head gasket leaks', 'Easy to use Pour-N-Go formula', 'Compatible with all types of antifreeze', 'Contains no solid or fibrous materials']",0%,0%,0%,0%,0%
14 x 12 x 12 inches; 39 Pounds,B0DKG44FD2,None,Ultrachem LLC,ULTRA 1PLUS Store,None,None,None,UL713,None,$126.95,None,None,"['OPTIMAL PROTECTION: U1P-Gear SAE 90 GL-5 Gear Oil, fortified with anti-scuffing additives, ensures advanced lubricity, safeguarding gears from high-torque stress.', 'HIGHLY SHEAR STABLE: Experience prolonged performance with our SAE 90 GL-5 Gear Oil, featuring exceptional shear stability, resisting wear even under extreme pressure conditions.', 'COMPREHENSIVE DEFENSE: Engineered for durability, our gear oil exhibits good oxidation resistance, foam resistance, and corrosion protection, extending equipment life for sustained reliability.', 'TACKINESS FOR STABILITY: This gear oil boasts a highly shear stable tackiness, providing lasting adhesion to gears, minimizing friction, and ensuring smooth, efficient operation.', 'RUST-PROOF PERFORMANCE: With robust rust resistance, our SAE 90 GL-5 Gear Oil guarantees long equipment life, maintaining gears in optimal condition and preventing deterioration.']",80,17,3,0%,0%
7.28 x 5.71 x 1.57 inches,B0DFBXKLXM,None,CA33411,QWORK Store,None,None,None,DG33411,None,$15.97,None,None,"['Materials: Constructed with rust-resistant metal and a rubber hose, ensuring long-lasting and safe use for your refrigeration system.', 'Comprehensive Kit: Includes a piercing valve, hex key, and two adapters, providing all the necessary tools for a complete recharge.', 'Wide Compatibility: Fits 1/4"", 5/16"", and 3/8"" diameter pipes, replacing multiple adapter types.', 'R134a Self-Sealing Adapter: Equipped with a male to female adapter for user-friendly connection to self-sealing cans and direct puncture of refrigerant cans.', 'Practical and Reliable: Features a pressure-resistant rubber hose with color-coded Fahrenheit gauge readings for accurate monitoring of R134, R12, and R22 refrigerants.']",0%,0%,0%,0%,0%
9.02 x 8.43 x 4.33 inches; 3.27 Pounds,B0DNV2Z2TZ,None,Permatex,Brand: Generic,None,None,None,None,None,$69.99,None,None,"['Fast-curing formula is sensor safe, low odor and non-corrosive', 'Retains high flexibility, oil resistance properties through use of a patented adhesion system', 'Ensures extended drivetrain warranty compliance', 'Temperature range -65F to 550F intermittent', 'Suggested Applications: Valve covers, oil pans, intake manifold end seals, timing covers, transmission pans']",0%,0%,0%,0%,0%
8.03 x 5.79 x 1.5 inches; 7.83 ounces,B0DQ244KCM,None,Permatex,Brand: Generic,None,None,None,None,None,$15.99,None,None,"['High Performance Formula - Ultra Grey Silicone Gasket Maker is Sensor-Safe, With a Formula Designed to Provide Reliable “Formed-in-Place” Gaskets for Mechanical Assemblies', 'Vibration Resistant - 82194 Ultra Grey Offers Maximum Vibration Resistance, Withstanding High Torque Loads While Creating a Tough, Flexible, Silicone Rubber Gasket', 'Long-Lasting Durable Silicone Gasket with Temperature Resistance from -65°F to 500°F (-54°C to 260°C).', 'Multi-Purpose Gasket Material - Ultra Grey Silicone Gasket Maker Retains High Torque and Vibration Resistance and Can Be Used to Replace Pre Cut Gaskets or Be Used as a Gasket Maker or Gasket Sealant', 'Suggested Applications: Valve Covers, Water Pump Housings, Intake Manifold End Seals, Thermostat Housings, Timing Gear Covers, Transmission Pans, and Oil Pans']",100,0%,0%,0%,0%
9.13 x 6.81 x 1.77 inches,B0DQ4RP5SR,None,Deicing Agent for Car Windshield,Brand: Generic,None,None,None,Deicing Agent for Car Windshield,None,$6.88,None,None,"['【Quick Defrosting】: Eliminate freezing windprotects with ease using our efficient ice removal spray. Penetrating quickly, it effectively removes frost and ice from the surfaces, saving you time and effort. Our powerful agent leaves no left or damage, providing a hassle-free solution in any weather conditions.', ""【Enhanced Safety】: Don't let ice on glass affect your driving. Spray our Snow Melting Spray before driving to quickly break down the ice, resulting in clear visibility and safe driving. Watch the rapid snow melting and enjoy a hassle-free ride."", '【Easy to Use】: Ice on the glass can affect the driving route before use. spraying, the ice and snow begin to melt into water. Melt ice, snow, defrost, spray, wipe, and the ice and snow will quickly mel.', ""【Convenient Size】: The 60ML(2.1 fl oz) bottle is small and lightweight, making it easy to store in your car's glove box or center console for quick access when you need it."", '【Vast Application】: Banish ice from exhaust pipes, mirrors, headlights & more without damaging surfaces Effortless application for furniture, glass, front windprotects, and keyholes. This deicing spray effectively removes frost or ice from your windshield surface. Simply spray deicer evenly, and after spraying, snow removal is made effortless. Perfect for clearing keyholes without introducing any damage.']",34,0%,24,0%,42
3 x 2 x 1 inches; 0.16 ounces,B0DPH9PT9N,None,LIIZOUSUDA,LIIZOUSUDA Store,None,None,None,None,None,$6.99,None,None,"['MEDIUM-STRENGTH THREAD SEALANT: High-temperature thread sealant locks and seals threaded fittings. Resists leakage, vibration loosening, moisture, hydraulic fluids, and diesel fuels. This high-temperature thread sealant lubricates threads for easy assembly and disassembly. Won’t shred or wear like Teflon tape.', 'HIGH TEMPERATURE SEALANT: Parts may be repositioned up to 4 hours after application. Temperature range -65°F to 400°F (-54°C to 204°C). Designed for the thread sealant for taper/taper threads and fittings.', 'EXCELLENT CHEMICAL AND THERMAL RESISTANCE: Locks and seals threaded fittings. Resists leakage, vibration loosening, moisture, hydraulic fluids, and diesel fuels. Lubricates threads for easy assembly and disassembly. (Please note the product is not recommended for use on plastic piping.)', 'SUGGESTED APPLICATIONS FOR AUTOMOBILES INCLUDE: Head bolts into through holes, oil PSI sending units and sensors, oil and coolant lines, fuel fittings, rear axle fill plug, brake and power steering fittings.', 'SUGGESTED HEAVY-DUTY APPLICATIONS INCLUDE: differential drain plugs and core plugs, pipe, water jackets, oil gallery plugs, oil pressure and temperature sensors, air conditioning fittings, hydraulic fittings, and vacuum line connectors.']",0%,0%,0%,100,0%
3 x 2 x 1 inches; 0.16 ounces,B0DP9SNZVB,None,LIIZOUSUDA,LIIZOUSUDA Store,None,None,None,None,None,$6.99,None,None,"['UNBREAKABLE BOND: These reusable threadlockers work with metal and plastic fasteners. They are applied to the fastener before assembly and once dried, create a firm, semi-solid layer inside the threads to absorb vibration and prevent loosening. Reusable threadlockers are designed for easy adjustment and removal', 'PROFESSIONAL-GRADE PERFORMANCE: Our Threadlocker has strong adhesive properties that hold screws, nuts, and metal fasteners securely in place and prevent loosening due to vibration. Our locking threadlockers are ideal for solving loose-fixing problems! Our thread lockers offer superior locking strength and unmatched reliability compared to other leading brands', ""WATERPROOF AND RUST-PROOF: Our Locking Threadlocker is heat- and water-resistant, giving you a long-lasting, secure lock that's perfect for indoor and outdoor use. It not only prevents leaks, rust, and corrosion but also saves you money on an expensive stock of locknuts and washers"", 'EASY TO USE: Our threadlockers are designed with a sealed, leak-proof design that prevents leaks. Simply apply Threadlocker evenly to the threads, tighten the nut, and it cures initially in 10 minutes, then fully cures in 24 hours', 'VERSATILE USE: Suitable for tightening and maintaining all the following metal screws, including automobiles, motorcycles, bicycles, furniture, household appliances, electronic and digital products, industrial equipment, and so on. Just one bottle of Threadlocker is all you need to ensure the proper and safe operation of your equipment']",100,0%,0%,0%,0%
6.26 x 4.21 x 3.11 inches,B0DPHKTQ33,None,12V,Brand: MICLSRS,None,None,None,Car Heaters for Vehicle,None,$15.88,None,None,"[""Efficient Heating & Defrosting: This 12V car heater plugs conveniently into your vehicle's cigarette lighter, providing quick heating. With a robust 150W power, it acts as an efficient windshield defogger and demister, enhancing driving safety by ensuring clear visibility."", '2-in-1 Heater & Fan: Our portable heater for cars serves dual functions to meet all your seasonal needs. It generates warmth during the chill of winter, and offers a cool breeze in the heat of summer.', '360° Rotatable Base: The heater is built with a 360° rotating base, allowing you to adjust the direction of the airflow as needed. The package includes double-sided tape to secure the heater at your preferred location.', 'Universal Compatibility: Designed for all vehicles with a 12V socket, our heater is a useful accessory for cars, golf carts, UTVs, and other vehicles. It also works as an efficient 12V heater for car camping adventures.', 'User-Friendly Installation: Setting up our car heater is a breeze. Just plug it into your vehicle’s cigarette lighter, choose your mode (heating or cooling), and enjoy a comfortable journey. The inclusion of double-sided tape ensures safe and stable installation.']",7,0%,0%,17,76
5 x 5 x 6.75 inches,B0DMWV2HY2,None,HY1021121,Brand: Autotecnica,None,None,None,HY1021121,None,$125.52,None,None,"['Guaranteed fitment', 'Replacement of your cracked and leaking power steering reservoir helps prevent low-fluid cavitation and ""run dry"" damage to power steering pump', 'Manufactured to OE power steering reservoir dimensions for proper clearance and factory appearance', 'High-quality heat and oil-resistant polymer tank material withstands intense engine heat and high pressure pump pulsation', '24 Month Unlimited Mileage Warranty']",0%,0%,0%,0%,0%
6.5 x 4.25 x 4.25 inches,B0DMWW65GD,None,CY1021302,Brand: Autotecnica,None,None,None,CY1021302,None,$69.50,None,None,"['Guaranteed fitment', 'Replacement of your cracked and leaking power steering reservoir helps prevent low-fluid cavitation and ""run dry"" damage to power steering pump', 'Manufactured to OE power steering reservoir dimensions for proper clearance and factory appearance', 'High-quality heat and oil-resistant polymer tank material withstands intense engine heat and high pressure pump pulsation', '24 Month Unlimited Mileage Warranty']",0%,0%,0%,0%,0%
6.38 x 2.52 x 2.4 inches; 5.61 ounces,B0DPM5NWRL,None,Hannaera,Hannaera Store,None,None,None,Medium-High-100ml,None,$9.99,None,None,"['Threadlocker: Thread locker has strong adhesion and can fix screws, nuts, and metal fasteners to prevent loosening due to vibration', 'Sealing and leakage prevention: Using thread locker cores instead of solid gaskets, close contact, perfect sealing, and effective leakage prevention', 'Prevents Rust and Corrosion: Protects from leaks, rusting, and corrosion and eliminates need to stock up on expensive lock nuts and washers', 'Easy to use: Simply apply the threadlocker evenly to the thread, tighten the nut, and cure initially for 20 minutes, then fully cure within 24 hours', ""Wide application: Whether you're installing a valve cover, water pump, or just tightening down some furniture screws, blue threadlocker has you covered. Our screw glue can be used on a variety of automotive, industrial and furniture applications""]",80,10,4,2,4
13 x 10 x 6 inches,B0DPKWL6YH,None,ACUSMAA6084,BlyeMichdi Store,None,None,None,ACUSMAA6084,None,$19.99,None,None,"['【Premium Material】 Our oil absorbing sheets are made of high density filter cotton, which is durable and not easy to tear, and has good oil absorbing and water absorbing performance. It is also very durable and can be used for a long time, giving you a good experience', '【Easy to Use】Our oil absorbing sheets measure approximately 10 x 13 inches, making them large enough for wiping garage tools, machines, cars, or as a mat. Easily cut to the size you want and as easy to use as paper towels, you can use the absorbent pads directly to keep your items clean and tidy without any tools', '【Composite Dimples】The surface of the oil absorbent pads is designed with mesh oil absorption holes, which can quickly absorb oil and water. The multi-layer fiber structure gives it a huge adsorption capacity, and it can quickly absorb oil while preventing all subsequent leaks and overflows', '【Versatile Use】These absorbent pads can absorb both oil-based and water-based liquids. Oil-based liquids such as gasoline, coolant, vehicle oil leaks, and machinery product leaks, as well as water-based liquids such as accumulated water, rainwater, and sewage', '【Package Includes】You will receive 50 pieces of 13×10 inch gray oil absorbent pads, packaged in a cardboard box. The ample quantity meets your various use and replacement needs']",0%,0%,0%,0%,0%
10 x 9 x 7.08 inches,B0DJX5VVWG,None,Oil Absorbent Pads,GOVNPJ Store,None,None,None,Oil Absorbent Pads,None,$27.99,None,None,"['PACKAGE INCLUDES: You will receive 100 pcs 13 x 9.8 inch gray oil absorbent pads packed in a cardboard box. Plenty of quantity to meet your various use and replacement needs.', 'VERSATILE USE: These absorbent pads can absorb both oil-based and water-based liquids. Oil-based liquids such as gasoline, coolant, automotive oil leaks and mechanical product leaks, and water-based liquids such as standing water, rainwater and sewage.', 'PREMIUM QUALITY MATERIAL: These absorbent pads are made of high melting point polypropylene fibers with excellent absorption capacity, each pad can absorb up to 12 times its weight in oil. They quickly absorb and lock in oil to prevent spills.', 'COMPOUND INDENTATION: The surface of the absorbent pads has compound indentations and vertical perforation lines, making them durable, abrasion-resistant and resistant to damage or tearing.', 'EASY TO USE: For smaller operating areas, absorbent mats can be used straight or cut to size; for larger areas, multiple mats can be spliced together; and for stationary areas, such as leakage zones underneath machines, multiple mats can be stacked together.']",0%,0%,0%,0%,100
16.93 x 9.65 x 3.94 inches,B0DL5XDY53,None,JYD-Threlaco-1928,Brand: Threlaco,None,None,None,JYD-Threlaco-1928,None,$19.99,None,None,"['You Will Receive: 10 pieces oil absorbent pads, which can be applied for a long time; This quantity ensures you always have a spare at hand, so they can relief you the stress of frequent ordering', 'Quality Material: our oil absorbent pads are made of quality filter cotton, so they are highly effective in containing oil spills; You can use our oil spill pads to preserve your surface away from oil spills', 'Ideal Size: the oil absorbent mat is about 17 x 30 inches/ 43 x 76 cm. The mat is large enough to absorb spills effectively yet compact enough to handle with ease. This size ensures easy placement and removal after usage', 'User Friendly: The oil absorbent pads are easy to use, which can provide an efficient solution for oil spills. you can Simply position these pads on top of the spill and they can work well. The pads can be disposed of after use conveniently', 'Wide Applications: our oil spill mats can be applied in workshops, garages, or any other location prone to oil spills. These pads are nice for both personal and professional spaces, which serve as a dependable spill cleanup solution']",36,64,0%,0%,0%
