Dimension,ASIN,Date_First_Available,Manufacturer,Store,Country_of_Origin,Best_Sellers_Rank,Color,Item_Model_Number,Item_Weight,Price,Amazon_Global_Shipping,Estimated_Import_Charges,Description,5-star,4-star,3-star,2-star,1-star
3.94 x 2.64 x 0.75 inches,B0DJZRMTJJ,None,R410A adapter,NEKPOKKA Store,None,None,None,R410A adapter,None,$12.95,None,None,"['【High quality material】The R410A adapter is made of high-quality brass material, with a hard and stable structure that is not easily broken or deformed, resistant to high pressure, and suitable for long-term use. The adapter adopts a top pin design, and the sealing ring inside the adapter can effectively prevent leakage.', '【Widely used】The adapter has a 5/16"" female to 1/4"" male horn mouth, suitable for most new R410A mini split air conditioners, HVAC systems, and other refrigeration equipment. This refrigerant tank adapter can connect the R12 hose to the R134A refrigerant tank and can accommodate R12, R22, and R134a systems.', '【Safe and convenient】R410a adapter with inflatable vacuum port adapter comes with a top pin, which will not open the air conditioning core tube during operation, completely solving the problem of fluoride leakage causing injury and ensuring safety. The coupler nut adopts a deep rolling flower design, which can be quickly tightened by hand. The service port is located at a 45 ° 90 ° right angle for easy use.', '【Product packaging】The kit includes 2 R410A direct rotation adapters, 2 45 degree angle adapters, 2 90 degree air conditioning tubeless charging vacuum port adapters, 1 spool remover, 5 ejector pins, 5 washers, and 5 5V1 valve cores.', '【Timely Reply】If you have any questions, please contact us by email and we will reply you within 24 hours']",31,44,0%,25,0%
6.42 x 3.78 x 0.59 inches,B0DHZ6DJQX,None,qph3210,Brand: PACLVIO,None,None,None,1,None,$7.99,None,None,"['[Excellent materials]: Carburetor cleaning brush is made of stainless steel and nylon materials, with anti-rust, no falling off, no deformation, good elasticity, can be used for a long time', '[Features]: Non-general purpose, motorcycle carburetor jet kit is mainly used to clean carbon dirt deposits, which can reach all difficult areas of the spray gun and any other small holes that need to be cleaned, even though stubborn paint can be cleaned', '[Size specifications]: These welding tip cleaner tools have different diameters, cleaning brush diameters :2mm, 3mm, 4mm, 5mm, 7mm. Cleaning needle diameter: 0.4mm, 0.5mm, 0.6mm, 0.7mm, 0.8mm, for different corners of the cleaning can be comprehensive', '[Widely used]: These carburetor cleaning kits can be widely used to clean small holes, narrow Spaces, such as spray guns, nozzles, pneumatic tools, camping stoves, etc. Suitable for all motor vehicles, motorcycles, ATV, welding machines, tattooers, lawn equipment and other power carburetors', '[Service]: Our spray gun cleaning kit is confident to get you like, if you have any questions, please let us know the first time, we will be the first time to solve for you']",0%,0%,0%,0%,0%
6.88 x 2.95 x 2.95 inches,B0DM1JHSNN,None,EK-083S,Brand: Narcilors,None,None,None,EK-083S,None,$15.99,None,None,"['Replaces Part Number -- EK-083S, please check the part number is same with your old one before purchase', 'Fitment -- The liquid line filter drier is for refrigerants R22, R134a, R404A, R407C, R502, R507', 'Feature -- This Refrigerant Filter Drier has a 3/8 inch ODF connection size, maximum working pressure 600PSI/4140Kpa, making it compatible with a wide range of heat pump models', 'Function -- This is a device designed to remove moisture and contaminants from the refrigerant in a heat pump system', 'Easy to Use -- Easy install, is a cost-effective solution for maintaining the performance and longevity of your heat pump system']",0%,0%,0%,0%,0%
6.3 x 3.35 x 0.51 inches; 2.82 ounces,B0DGGF2SJM,None,Gzingen,Brand: Gzingen,None,None,None,GZ-5Cleaner,None,$6.99,None,None,"['PACKAGE INCLUDE -- 1 x Golden Color Nozzle Wash Repair Cleaning Needle; 2 x Nylon Tube Brushes(10 brushes); 2 x Stainless Steel Cleaning Scraper Needle(20 Needles); 1 x Oil cleaner box (each box includes 13 pieces cleaning wires inside)', 'Carb Carburetor Jet Cleaners are Made of 304 stainless steel flexible handle, no deformation. with nylon and spiral bristles, easily clean paint, dirt and other debris off. good elasticity, no hair loss, Reusable after cleaning', 'Wide Applications: Suitable for all auto motorcycles, ATV, Welder, tattoo device, lawn equipment and many other power sport carburetor. Cleaning needles and brushes are useful to clean small orifices such as spray nozzles, air tools, camping stoves jets, and so on', '13 PIECE CARBURETOR Cleaning Needle Set: This wire set come with 13 different diameters, especially designed to clean out the tiny jets and carb passages from all dirt. Comes with a lightweight, compact aluminum carrying case, easy to store and carry', 'AIRBRUSH AIR CAP WASH NEEDLE: This airbrush tool can scrape all the dried paint off the air cap hole which is between 0.3mm to 1.2mm']",100,0%,0%,0%,0%
8.2 x 6.4 x 6.6 inches,B0DCGMG1HS,None,MZ-21,Brand: GROVE,None,None,None,MZ-21,None,$20.80,None,None,"['PERFECT BUNDLE SET - This set includes 2x AGS Graphite Lubricant Powder bundle with 1x Microfiber Cloth, ensuring easy application and maintenance while keeping surfaces clean and lubricated. (Packaging May Vary)', 'EXTRA FINE GRAPHITE - This all-purpose dry powder lubricant is made with ultra-fine graphite, providing smooth lubrication for various surfaces, ensuring optimal performance and reducing friction.', 'ALL-PURPOSE USE - Suitable for use on a wide range of materials, including metal, wood, plastic, and rubber, providing a seamless, non-greasy solution for diverse maintenance needs.', 'ODORLESS AND NON-TOXIC - Formulated to be completely odorless and non-toxic, this lubricant is safe to use in a variety of environments without causing unpleasant smells or harmful effects to users.', 'YEAR-ROUND APPLICATION - Designed for year-round application, this versatile lubricant can be used in all seasons and climates, making it a reliable choice for both indoor and outdoor maintenance tasks.']",0%,0%,0%,0%,0%
7.52 x 5.98 x 0.98 inches,B0DCFPFV78,None,BG-1,Brand: GROVE,None,None,None,BG-1,None,$7.52,None,None,"['PERFECT BUNDLE SET - This set includes 1x AGS Bulb Grease bundle with 1x Microfiber Cloth, ensuring easy application and a clean finish while protecting electrical connections. (Packaging May Vary)', 'PREVENTS CORROSION - This dielectric grease prevents corrosion on bulbs and electrical connections, ensuring a longer-lasting and more reliable performance in your lighting and electrical systems.', 'EASY BULB REMOVAL - Applying this grease helps make future bulb removal easier, especially for hard-to-reach lights like headlamps and taillights, allowing quick and hassle-free replacements when needed.', 'VERSATILE USAGE - Suitable for use on a wide range of bulbs including taillights, headlights, floodlights, and household light bulbs, offering comprehensive protection for all types of electrical lighting.', 'ENHANCES ELECTRICAL CONNECTIONS - The grease ensures a solid, moisture-resistant seal on electrical connections, improving conductivity and reducing the risk of rust or moisture-related issues over time.']",0%,0%,0%,0%,0%
10.12 x 10.04 x 5.16 inches,B0DLLJSPXV,None,LF3620,Brand: Compass-Yang,None,None,None,2 pcs,None,$35.99,None,None,"['Replace Number:Fleetguard LF3620, Baldwin B495, Donaldson P552100, Luber Finer LFP2160, Wix 51971, Detroit Diesel 23518480 25014504 23530573 23527033 23524251, GMC 25014507 25014505, Mack 5839LF3620 3076PH7405A, Kohler 343445, Atlas Copco 5541762100 2914806700, Prevost 510458, VOLVO 3915586, CUMMINS XLF5000, FORD 9576P552100', 'Compatible with Freightliner - FLD132, FLD120, FLD120SD, CST120, C120, FLC, ARGOSY, Classic, Argosy, Columbia, Coronado, Cascadia 125, Century Class, Classic XL, COLUMBIA CL112, Coronado CC132, COLUMBIA CL120, CENTURY CLASS S/T, CENTURY CST120, ARGOSY AUSTRALIA', 'Compatible with International - 9200I, 9900I, 3800, 8200, S3600, 4700, 3000 SERIES', 'Compatible with Atlas Copco - QAS 168, QAS 228, QAS 278, QAS 338, MT2000, MT436B, ST1520, ST8C, XASE 1600', 'Compatible with Ford - LT9513 AT9513 LTS9000 LTS9000', 'Compatible with Kenworth - T404 T404S T604 T601 K100G T950 T900', 'Compatible with Western Star - 4800SB 4900TS 4900SF 4900XD 4900SA 4900EX 4900SB 4900FA 4964FX 6900XD 6900TS']",0%,0%,0%,0%,0%
7.05 x 4.8 x 3.31 inches,B0DKX5JR8T,None,Deicer Spray for Car Windshield,Brand: Generic,None,None,None,Deicer Spray for Car Windshield,None,$7.88,None,None,"['【Quick Defrosting】: Eliminate freezing windprotects with ease using our efficient ice removal spray. Penetrating quickly, it effectively removes frost and ice from the surfaces, saving you time and effort. Our powerful agent leaves no left or damage, providing a hassle-free solution in any weather conditions.', ""【Enhanced Safety】: Don't let ice on glass affect your driving. Spray our Snow Melting Spray before driving to quickly break down the ice, resulting in clear visibility and safe driving. Watch the rapid snow melting and enjoy a hassle-free ride."", '【Easy to Use】: Ice on the glass can affect the driving route before use. spraying, the ice and snow begin to melt into water. Melt ice, snow, defrost, spray, wipe, and the ice and snow will quickly mel.', ""【Convenient Size】: The 60ML(2.1 fl oz) bottle is small and lightweight, making it easy to store in your car's glove box or center console for quick access when you need it."", '【Vast Application】: Banish ice from exhaust pipes, mirrors, headlights & more without damaging surfaces Effortless application for furniture, glass, front windprotects, and keyholes. This deicing spray effectively removes frost or ice from your windshield surface. Simply spray deicer evenly, and after spraying, snow removal is made effortless. Perfect for clearing keyholes without introducing any damage.']",23,10,0%,28,39
12 x 8 x 4 inches,B0D4FG8NH5,None,235116388,Chevron Store,None,None,None,235116388,None,$34.95,None,None,"[""Delo 400 NG is formulated with Chevron's ISOSYN Technology which incorporates premium base oils, shear stable viscosity modifier and a low ash additive package specially formulated for long service"", 'Helps minimize valve recession and deposits', 'Helps minimize oil consumption', 'Promotes engine reliability and durability through exceptional wear protection', 'Exceptional soot dispersancy and wear control - Cylinders, pistons, rings, and valve train components are well protected against wear, providing optimum service life and minimal maintenance, contributing to maximum equipment utilization and minimal downtime.']",0%,0%,0%,0%,0%
13.98 x 6.3 x 5.71 inches; 3.62 Pounds,B0DKSR8SD8,None,SONAKY,Brand: SONAKY,None,None,None,None,None,$59.99,None,None,"['[Compatible With]: This Engine Transmission Oil Cooler is compatible with Ford F250 F350 Super Duty 2011-2016 6.7L V8.', '[Replace Part Number]: BC3Z-7A095-C BC3Z7A095C To ensure that this product is suitable for your vehicle, please confirm the item if it matches your car before you purchase. Please make sure the OE number matches the part you are replacing', '[High Quality]: Our products are made of high-quality raw materials through professional production technology, High standard manufacturing processes and high-quality manufacturing materials ensure stable product performance, maintain high efficiency in various working conditions, and have a long service life', '[Easy Installation and Operation]: Easy and Direct Replacement.', '[Package Include]: Package: Oil Cooler ×1 (as shown in pictures)']",0%,0%,0%,0%,0%
6.38 x 2.36 x 1.14 inches; 2.89 ounces,B0DGXVXZW6,None,Bellisinno,Brand: Bellisinno,None,None,None,medium-50ml,None,$6.99,None,None,"['BLUE THREADLOCKER: Our medium-strength blue threadlocker, which can meet your various needs! With excellent adhesion and long-lasting anti-loosening effect, ensuring screws, nuts and metal fasteners are firmly fixed in place. Even in high-vibration environments, our products can provide reliable solutions', 'KEEP FASTENERS SECURE AND TIGHT: Our thread lock has strong adhesion to hold screws, nuts and metal fasteners firmly in place, preventing loosening due to vibration. Our threadlocker is the ideal choice to solve your loosening fixing problems!', 'WATERPROOF AND RUSTPROOF: Our blue threadlocker is heat and water resistant, providing you with a long-lasting and secure lock, perfect for both indoor and outdoor use. Not only does it effectively prevent leaks, rust and corrosion, it also saves you the cost of stocking expensive lock nuts and washers', 'EASY TO USE: Our thread locker features a sealed and leak-proof design to prevent leaks. Simply apply the thread locker evenly to the threads, tighten the nut, and cure initially for 20 minutes, then fully cure within 24 hours. Red threadlocker simply heat the nut or bolts to 300 ℉ for 10 minutes and remove with hand tools', 'AFTER-SALES SERVICE: Our thread lock is suitable for a variety of automotive repair, industrial and furniture applications. Its reliable performance and versatility make it an ideal choice for a variety of uses. If you are not satisfied with our threadlocker, please contact us through Amazon and you will get satisfactory service']",78,14,5,1,2
12.99 x 10.15 x 0.05 inches,B0DG5N7K13,None,SSNNUU-Xi You Dian-0505,Brand: SSNNUU,None,None,None,Car Oil Absorbent Pads,None,$8.89,None,None,"['Universal Adsorption: The oil absorbent pads show excellent liquid absorption ability, whether it is water, oil or difficult solvents, pigments and dyes, can be easily absorbed, everything can be absorbed, to deal with all kinds of liquid spills with ease', 'Ultra-Strong Adsorption: The oil absorbent pads powerful adsorption performance is amazing, within a short period of time can absorb liquid equivalent to 10-20 times its own weight. The oil absorbent pads size is 12.99*10.15*0.05 inch', 'Reuse: After adsorption, the absorbed liquid can be released by simple squeezing, restoring the original adsorption capacity and recycling, which is both affordable and saving, and is ideal for dealing with liquid leakage', 'Excellent Quality: The oil absorbent pads made of excellent quality materials, delicate and soft touch, the use of the process will not scratch or injure the surface of the items in contact with, it easy to long-term preservation and proper disposal', 'Easy to Maneuver: Small areas directly laid or cut the oil absorbing pads as needed; large areas can be easily spliced with multiple pads to cover; for high-risk leakage areas, multiple layers of pads can be stacked to strengthen the absorption effect']",49,51,0%,0%,0%
5.12 x 1.97 x 0.79 inches,B0DK5B6ZST,None,Osilly-Auto,Brand: Osilly,None,None,None,Osilly-Auto10,None,$9.99,None,None,"['【Premium Quality Material】: Our products are made of nylon and stainless steel. The nylon material has a lower density, thus making the carburetor cleaner lighter in overall mass and easier to carry and operate. The stainless steel material has high strength and hardness, which can withstand greater pressure and impact, thus ensuring the stability and reliability of the carburetor cleaner in use.', ""【Versatile Cleaning Function】: Our carburetor cleaning kit is designed to remove hidden clogs. Whether it's a tiny crevice or a twisted line, this cleaning kit gets in deep to provide a total cleaning experience. Our kit quickly breaks down and removes the dirt that have built up on carburetors and jets to restore clarity."", '【Use Broadly】: These torch nozzle cleaners can be used to clean small holes and tight spaces such as gun nozzles, torch tips and any small holes that need cleaning such as fluid nozzles and air caps, thus easily cleaning all hard to reach areas, especially for fluid nozzles and air caps. In addition, the gun nozzle cleaner is suitable for motorcycles, ATVs, welding machines, tattoo machines, lawn equipment and most types of powersports carburetors.', '【Convenient and Portable】: Our product is easy to use and carry, thus making it the ideal on-the-go tool. 10 cleaning needles are neatly placed in a blue storage box with a removable key ring for easy organization and access. With proper use, they can easily be cleaned multiple times to ensure longevity and efficiency. This kit extends the life of carburetors and other machines.', '【Essential Cleaning Tools】: You will receive 10 cleaning needles and 5 cleaning brushes. This gun cleaning kit can easily help you clean out those troublesome corners and make your work easier. The 10 cleaning needles are 4.33 inches in length, which can easily meet the cleaning needs of the gun, nozzles, torch tips, weld heads, cleaners and other confined spaces. This cleaning kit is designed to help you clean out those troublesome corners and make your work easier.']",0%,0%,0%,0%,0%
0.95 x 0.18 x 4.46 inches; 0.96 ounces,B0DGCTW4H1,None,LandTank,LandTank Store,None,None,None,MT-0023,None,$7.39,None,None,"['High Density Nylon, Good Elasticity, No Hair Stainless Steel Wire Winding, Rust, Flexible Handle, No deformation Stainless steel wire winding, rust, flexible handle, no deformation', 'Please check your items model with our pictures carefully before paying If there is any damage, please contact us within ten days', ""【Landtank】let's go shopping with confidence, refund and confidence.""]",100,0%,0%,0%,0%
10.24 x 7.48 x 3.94 inches,B0DK78YVSB,None,CookiBlend,Brand: CookiBlend,None,None,None,4K24126CYI87IA9677815LV659S40,None,$19.99,None,None,"['[SOLAR-POWERED EFFICIENCY]: This portable car heater converts sunlight into electricity, providing effective heating without external power sources. Stay warm during winter travels with this innovative solution that harnesses renewable energy for your comfort.', '[FROST AND SNOW SOLUTION]: Designed for winter use, this heater generates warm air to assist with frost and snow on your windshield. It aims to reduce the need for manual scraping, potentially enhancing your driving safety and comfort during cold weather.', '[COMPACT AND LIGHTWEIGHT]: With its 261910cm size, this heater is easy to carry and conveniently fits in your vehicle. Take warmth with you wherever your journey leads, ensuring comfort in various winter driving situations.', '[BUILT-IN BATTERY STORAGE]: Featuring a battery box, this heater stores excess solar energy for extended use. Once fully charged, it can operate independently for 2-3 days, offering reliability during long trips or periods of limited sunlight.', '[VERSATILE WINTER COMPANION]: Suitable for daily commuters and outdoor enthusiasts alike, this solar automotive heater is designed for situations where quick air drying is needed. It aims to make winter driving more manageable and comfortable for a wide range of users.']",0%,6,0%,6,88
0.04 x 0.04 x 0.04 inches,B0DGTQ2JDP,None,LEE141,Brand: leediga,None,None,Blue & Red,LEEDQ2400BERE-20PCS,None,$7.59,None,None,"['Sealing Function: This automotive grommet round gasket is suitable for all standard handles of semi-trailers, providing a good sealing function. Just press the bottom into the handle. Each seal is designed to fit perfectly with all standard handles, providing a tight and seamless fit.', 'Design: With a tapered base design with enough bounce arc, this product can be easily inserted into the universal air hose hand pull seal gasket for semi trucks.', 'Durable Material: This automotive grommet round gasket is made of waterproof and durable rubber material, soft to the touch and smooth surface. It can be used normally in extreme temperatures, so you can buy it with confidence.', 'Package List: After purchase, you will receive 20 x automotive grommet round gaskets, they are durable, elastic, tough, wear-resistant, with perfect sealing and compatibility. The gasket is convex in the middle to make the seal tighter.', 'Universal Fitting: This automotive grommet round gasket is suitable for most industry standard hand seals and can be used in many types of vehicles. Carry the seal with you and replace it immediately when necessary.']",0%,0%,0%,0%,0%
11.89 x 7.99 x 5.2 inches; 10.71 Pounds,B0D3ZZ7HW2,None,H.O.W AUTO DETAILING & CARE,H.O.W AUTO DETAILING & CARE Store,None,None,None,HB0012,None,$63.96,None,None,"['【30 Second Quick Reaction】Rapidly softening iron particles.Instant effectiveness upon spraying, with enhanced results when used with a high-pressure water gun.', '【Free of Organic Solvents】Special formula free from organic solvents, gentle and safe for car paint.', '【Wide Application】Suitable for industrial dust, brake dust, and paint surface iron spots. The water-based solvent can be applied directly without dilution, offering versatile use.', '【PH 6.0~8.0】Neutral cleaner with fast decomposition. Free from nonylphenol surfactants. (Nonylphenol is an environmental hormone that is believed to be potentially associated with female breast cancer and male prostate cancer.)', '【H.O.W Detailing and Care】H.O.W provides all the supplies you need for every step of car detailing; additionally, effective customer service and car detailing expertise are offered to support you as a strong backup']",100,0%,0%,0%,0%
6.61 x 3.98 x 0.55 inches; 2.08 ounces,B0DGPZGQQG,None,HUAREW,Brand: HUAREW,None,None,None,LHM-CCTK,None,$6.99,None,None,"['Overall cleaning: The carburetor cleaning tool kit comes with 10 cleaning needles, 10 nylon brushes, a pointed pick tool and 13 cleaning wires of various diameters to provide a thorough cleaning. Different sizes fit every need and cover every corner with thoughtful details.', 'Quality material: This carburetor cleaning kit is made of high-density nylon brushes and stainless steel, anti-rust, anti-deformation and durable. Spiral bristles can penetrate deep into the interior, easy to clean, even the obstacles at the corners can be easily cleaned. Provide you with effective and comprehensive cleaning.', 'Wide use: These cleaning pins and brushes are suitable for cleaning all kinds of small holes. Such as spray guns, nozzles, air tools, camping stoves and so on. They are also suitable for all cars motorcycles, ATVs, welders, tattoo equipment, lawn equipment, snow blowers and many other powersports carburetors.', 'Portable: Designed for mobile maintenance, our cleaning kit comes with a removable key ring and storage case for easy access. Hang it in your workshop or keep it in your toolbox for quick and easy access when you need it and easy cleaning anytime, anywhere.', 'Package Includes: Stainless Steel 13-piece Cleaning Line Set + 10 Nylon Brushes + 10 Cleaning Needles +1 Throttle Wrench + 1 Tip Pick']",0%,100,0%,0%,0%
7.44 x 4.53 x 0.55 inches,B0DJ71PYNP,None,Przebzes,Brand: Przebzes,None,None,White,SIDE,None,$7.99,None,None,"['Exclusive proprietary adapter: Gray nozzle with gray adapter fits most brands of aerosol cans. There are female nozzles and adapter. adapter allows you to use the female nozzles as male nozzles. In other words. You get nozzles that can be used as female can or male can.', 'Reusable: Unlike disposable extensions, It fit can be applied in multiple painting projects and can be reused by flushing it clean after each use, making it a practical and cost-effective choice.', 'Flexible: With a hose length of approximately 23 inches, the hose can easily reach those hard-to-reach areas; with its flexible design, it can easily bypass all obstructions.', ""Efficiency-enhancing: Whether you're cleaning, or painting, the aerosol can extension nozzle hose fitting set is a great tool for the job; it works with most aerosol and spray cans for precise, even coverage."", 'Easy to use: Split design nozzle allows you to use it on more types of aerosol cans and can be used directly after receiving the product. \ufeff']",82,0%,18,0%,0%
3.15 x 2.76 x 1.18 inches; 2.08 ounces,B0DJX8SZYQ,None,Chamixx,Chamixx Store,None,None,None,None,None,$18.50,None,None,"['Part Number: 861150T02 22-861150T02 22-861150A2 22-861150A1 22-861163', 'Application Models: Compatible With MerCruiser Alpha Stern Drive 1996-1998 Bravo Stern Drive 1998 Race Stern Drive 2002 2004 2006', 'Performance: Helps maximize the performance of your stern drive by ensuring proper gear lube flow and reducing the risk of leaks', 'Material: Typically made from durable materials to withstand marine environments', 'Installation: Designed for easy installation']",0%,0%,0%,0%,0%
