Dimension,ASIN,Date_First_Available,Manufacturer,Store,Country_of_Origin,Best_Sellers_Rank,Color,Item_Model_Number,Item_Weight,Price,Amazon_Global_Shipping,Estimated_Import_Charges,Description,5-star,4-star,3-star,2-star,1-star
3.54 x 2.36 x 1.18 inches,B0DSH2S83D,None,DT-51190,Brand: KMBNTU,None,None,None,DT-51190,None,$40.99,None,None,"['Compatibility: Designed as a transmission oil fill adapter for GM 8L90 engines, ensuring a perfect fit and seamless installation', 'Replacement Part: Serves as a direct replacement for the DT-51190 part number', 'Durable Construction: The transmission oil fill adapter is made of high-quality materials that can withstand the needs of automotive applications and provide long-lasting performance', 'Easy Installation: Straightforward installation process, allowing for efficient and hassle-free maintenance or repair tasks', 'Buy With Confidence: Once there is a problem with this transmission oil fill adapter, contact us here to solve it perfectly for you, without worrying about after-sales problems']",0%,0%,0%,0%,0%
8.81 x 2.88 x 2.88 inches; 10.41 ounces,B0DRW9G5QD,None,J-B Weld,J-B Weld Store,None,None,None,31314-2,None,$12.99,None,None,"['J-B Weld Hi-Temp Red Silicone Gasket Maker and Sealant is an RTV Silicone gasketing material, designed for use in mechanical assemblies where the existence of higher, continuous temperatures up 650°F.', 'Upon curing, which occurs when the product is exposed to the moisture in air, the silicone forms a tough, waterproof seal on most surfaces.', 'It will not shrink or crack, resists weathering, and is great for many automotive applications.', 'Great for oil pans, valve covers, exhaust manifolds, differential covers and more']",80,13,4,1,2
7.4 x 5.7 x 0.47 inches; 3.2 ounces,B0DQ5HKRN5,None,Generic,Brand: Generic,None,None,None,Carburetor Cleaning Tool,None,$9.99,None,None,"['Comprehensive Tool Set: This carburetor cleaning tool kit features 2 stainless steel wire double-ended brushes, 2 phosphor bronze wire double-ended brushes, and 4 nylon double-ended picks. Designed for precision, these tools effectively remove stubborn clogs, making them ideal for cleaning welding torch tips and gas orifices', 'Durable and Reusable: Crafted for longevity, this carburetor cleaner kit can be reused multiple times to clear debris from jets and small orifices. Perfect for unclogging natural gas and propane jets, as well as engine carburetors, ensuring optimal performance every time', 'User-Friendly Design: The spiral-shaped cutting torch nozzle cleaner is specifically engineered to address clogs caused by residue buildup during cutting. Regular use not only unclogs nozzles but also enhances their durability, making your cutting tools more efficient', 'High-Quality Materials: Made from high-density nylon and premium stainless steel, our carburetor cleaning tools are rust-resistant, non-deformable, and durable. The spiral bristles penetrate deep into narrow passages for a thorough and effective cleaning, ensuring no debris is left behind', 'Versatile Applications: This welding gun nozzle cleaning tool kit is perfect for a variety of uses, including cleaning small holes in spray guns, nozzles, pneumatic tools, and camping stoves. It is also suitable for most vehicles, motorcycles, ATVs, welding machines, tattoo machines, lawn equipment, and other small engine carburetors']",100,0%,0%,0%,0%
0.04 x 0.04 x 0.04 inches,B0DNSMPDDH,None,VOWBMPN12,Brand: Vowbrew,None,None,None,VOWBRG606BL-30PS,None,$5.09,None,None,"['Package List: Package includes 1 piece 13.1 Ft windshield washer hose, 30 pieces hose connectors, including T-connector, measuring 1.34 "" x 0.8 "", I-connector, measuring 1.3 "", Y-connector, measuring 1.4 "" x 1.1 "".', 'Flexible Material: This cleaning hose is made of rubber material, with good flexibility and wear resistance, not easy to age. It is not easy to break when bent, and does not affect the jet, so you can use it with confidence.', 'Plastic Connector: This hose connector is made of plastic material, one-piece molding process, reliable workmanship, not easy to rust, ensuring the purity of the cleaning water. The structure is sturdy and durable, with good sealing and not easy to leak.', 'Function: The product can directly connect the water pump and nozzle correctly, restore the original function, ensure that the cleaning water can be sprayed smoothly on the windshield surface, restore a clear view, and drive safer.', 'Universal Accessories: This product directly replaces the damaged leaking hose, suitable for most cars, trucks, etc. The hose can be freely cut to meet your usage needs. Precision design, tight connection, not easy to fall off.']",0%,0%,0%,0%,0%
5 x 2 x 0.05 inches,B0DP9C95TY,None,DT-51190,KAKSEY Store,None,None,None,DT-51190,None,$41.49,None,None,"['Compatibility: Transmission oil fill adapter for GM 8L90. For GM 8L90 Engine, it has no oil fill tube. Replace: DT-51190. Material: steel', 'Product Feature: The filling adapter threads into the bottom of the pan for filling of the transmission using the J-45096 TransFlow', 'Direct Replacement: Meets OE standards and matches the original oil fill adapter. Direct replacement for genuine OEM parts and works as smoothly as the original', ""Product Function: The oil filling adapter connects to the transmission's oil fill port, simplifying the oil filling process and preventing fluid leakage"", 'Service: We will provide excellent service and do our best to give you a satisfactory answer']",0%,0%,0%,0%,0%
2.4 x 2.09 x 1.73 inches,B0DR75PC4S,None,JQA001TOFA,Brand: JKIANTECH,None,None,None,DT-51190,None,$30.99,None,None,"['【Precise Fit for GM 8L90 Transmission】- Designed specifically fit for GM 8-speed automatic transmissions, including 8L90, ensuring a secure connection to the fill port for accurate fluid filling and maintenance. DT-51190 threads into the bottom of the pan for filling of the transmission using the J-45096 TransFlow', '【Durable OEM-Quality Construction】- Made from high-strength, corrosion-resistant materials to withstand repeated use in demanding automotive environments, delivering long-lasting performance', '【Efficient & Clean Fluid Filling】- Works seamlessly with standard fluid pumps, enabling quick and spill-free transmission fluid filling to the exact level specified by GM guidelines', '【Essential Tool for Professionals and DIYers】- Ideal for both professional mechanics and automotive enthusiasts, this adapter simplifies the process of fluid replacement and level calibration, saving time and effort', '【Compatible with GM-Approved Fluids】- Specifically engineered for use with approved transmission fluids, to ensure proper lubrication and optimal performance of your vehicle’s transmission']",0%,0%,0%,0%,0%
6.69 x 2.44 x 1.73 inches; 0.63 ounces,B0DP6WB9YS,None,Choowin,Brand: Choowin,None,None,None,None,None,$9.99,None,None,"['HIGH-QUALITY PINEWOOD CAR GRAPHITE POWDER : Our graphite powder is made of high purity natural flake graphite. High purity (99%), large flakes, moderate mesh size (3000 mesh), easier to adhere, and can effectively form a lubricating film barrier on the surface.', 'MINIMIZE FRICTION : Our pinewood derby car graphite powder will minimize the friction between your pine derby car wheels and axles. It will make your pinewood car faster and help you win the race.', 'EASY TO USE : Our graphite lubricant comes with a metal pointed tip, which can be easily applied to pinewood derby wheels and axles. And it comes with a plastic cap for long-term storage and use.', 'WIDE RANGE OF USES : This graphite dry film lubricant can also be used as a lock lubricant, door hinge lubricant, suitable for squeaky hinges, bicycles, tools and rusty surfaces.', 'SERVICE SUPPORT : If you have any questions about the product or need help, please feel free to contact us. We will provide you with the most thoughtful service.']",86,14,0%,0%,0%
4.76 x 2.32 x 2.32 inches; 8.78 ounces,B0DPH6VLH6,None,Keze,Keze Store,None,None,None,CA-Dielectric-8oz,None,$15.99,None,None,"['Protect Battery Terminals & Connectors: Shield your car’s battery terminals and electrical connections from moisture, salt, and corrosion. Seal, lubricate and insulate to prevent leaks and damage, ensuring top performance and vehicle quality.', 'Perfect for Spark Plugs: Extend the life of spark plugs, bulb sockets, and ignition coils with this non-conductive grease. It prevents arcing and corrosion for optimal engine performance.', 'Withstands Extreme Temperatures: Built to withstand freezing winters and scorching summers, this grease stays effective from -40°F to 428°F, ensuring year-round protection.', 'Waterproof & Corrosion-Resistant: Prevent rust and corrosion with this durable, waterproof formula. Ideal for vehicles exposed to rain, snow, or coastal environments.', 'Easy to Apply, Long-Lasting: Its smooth, non-drying formula is easy to apply and provides long-lasting protection, reducing maintenance and saving you time.']",88,10,0%,0%,2
35.6 x 14.2 x 8 inches,B0DLW7CWSZ,None,EW6516,ELITEWILL Store,None,None,None,EW6516,None,$226.99,None,None,"['Perfect Fit for Chevy Silverado GMC Sierra 1500 Long Bed (2007-2014) – Specifically designed to repair the 2007-2014 2nd Gen Chevrolet Silverado and 3rd gen GMC Sierra 1500 Ext & Crew Cab, this pickup Frame Rust Repair Kit ensures a precise fit, making installation quick and hassle-free.\ufeff\ufeff', 'Durable Rust Prevention – Zinc-coated surface treatment effectively prevents rust and does not affect the welding.Protect your truck from the damaging effects of time with this high-quality repair kit, engineered to restore and reinforce the frame, extending the lifespan of your vehicle.', 'High-Quality Steel Construction – This product is crafted from durable, corrosion-resistant steel that are designed to withstand the elements and provide long-lasting performance.', ""Restore Structural Integrity & Safety – With this repair kit, you can restore your Silverado’s frame integrity, improving its strength and safety, while preventing further rust damage that could compromise the vehicle's performance.Repair your pickup truck to restore its functionality, whether it's transporting goods, building materials, furniture, or going camping and off-road with family and friends."", 'Installation:No need to remove the original frame, but before installation we do recommend removing the rusted section, slide the replacement in place, and weld it solid.Professional installation is recommend.']",63,0%,0%,0%,37
2.36 x 2.36 x 6.5 inches; 5.61 ounces,B0DS28H6HY,None,EPASUN,EPASUN Store,None,None,None,None,None,$9.99,None,None,"['Value Threadlocker: Medium-strength blue Threadlocker and High-strength red Threadlocker, providing a wide range of options for your various needs. 2 x 50ml bottles of thread locker are easy to store and can be used for a long time without drying out or leaking', 'Keep Fasteners Secure and Tight: EPASUN lock tight threadlocker has strong adhesion and keeps screws, nuts, and metal fasteners securely in place to prevent loosening caused by vibrations', 'Waterproof and Rust-Resistant: This thread locker pack is heat-resistant and waterproof, providing a strong and consistent lock ensuring durability against leakage, corrosion, and loosening, ideal for indoor and outdoor use', 'Quick and Hassle-free: Simply apply the thread locker evenly to the thread, tighten the nut, and cure initially for 10 minutes, then fully cure within 24 hours. If you ever need to take it off, it can be easily removed using basic hand tools', ""Versatile Usage: Whether you're working on automotive repairs, tightening furniture screws, or handling industrial tasks, Its reliable performance and versatility make it ideal for automotive, industrial, and furniture use, saving you time and effort""]",76,20,0%,0%,4
1.5 x 1 x 5.5 inches; 1.8 ounces,B0DQWR5198,None,Polixel,POLIXEL Store,None,None,None,SADHESIVE,None,$13.99,None,None,"['Fast Curing: This sealant is designed for quick curing, typically reaching a tack-free state shortly after application, forming a strong seal quickly. This makes the application process more efficient, suitable for projects that require rapid completion and saving waiting time.', 'Multi-Purpose: This sealant is suitable for a wide range of applications, including home repairs, construction projects, automotive sealing, and boat repairs. It adheres firmly to various surfaces such as metal, glass, plastic, and ceramics, meeting the needs of different materials. Whether for new construction or maintaining older facilities, it is an ideal choice.', 'Easy to Use: The sealant features a user-friendly formulation, ensuring that both professionals and DIY users can use it with ease. Its excellent flow allows for easy application directly from the tube, making it ideal for tight or irregular spaces, ensuring that every corner can be perfectly sealed.', 'Waterproof and Weather Resistant: This product boasts outstanding waterproof capabilities, effectively resisting rain, moisture, and other factors. It is suitable for outdoor and humid environments. Additionally, its weather resistance is exceptional, showing little degradation due to UV exposure, extreme temperatures, or frost, ensuring stability and reliability for long-term use.', 'Strong Adhesive Strength: The sealant offers excellent adhesive strength, effectively bonding various materials and forming a high-strength connection. This powerful adhesion ensures lasting stability of seals and connections, helping to prevent air and water infiltration, especially in environments where pressure or vibration is expected.']",72,0%,14,0%,14
5 x 1.5 x 5 inches; 2.47 ounces,B0DRG654G9,None,BUFFZIT CAR BUPPLIES Corp,BUFFZIT Store,None,None,None,ASRS25,None,$13.99,None,None,"['Efficient and long-lasting seal: Our car sealant is designed for ease of use, providing a durable and robust seal in any area that requires sealing. This solution helps you save time and money by efficiently completing the sealing task with minimal effort.', 'Weather resistant: The Black Auto Sealant is engineered to withstand extreme temperatures, both high and low, while preserving its elasticity and sealing capabilities across various challenging climates.', 'Outstanding sealing performance: This car body sealant offers strong sealing and leak-proof features. It withstands vibrations, expansion, and impact, remaining effective all the time.', 'Versatile applications: Ideal for diverse automotive sealing and repair needs, this car sealant is perfect for use on doors, windows, windscreens, roofs, and bonnets. It effectively addresses issues related to water leakage, wind infiltration, and soundproofing.', 'EASY TO USE: the auto windows sealant requires no special skills for application. Just apply the sealant to the desired area and allow a moment for a sturdy, lasting seal to take hold.']",85,0%,0%,15,0%
3 x 1 x 1 inches; 0.96 ounces,B0DS66VVRY,None,Brownells,Brownells Store,None,None,None,430-110-337,None,$12.99,None,None,"['High strength hold red threadlocker, 140-300 lb/in', 'Made in the USA', 'Not recommended for use with plastics or in oxygen rich environments']",0%,0%,0%,0%,0%
15.75 x 9.84 x 2.76 inches,B0DMSFKKWT,None,JYD-Threlaco-1987,Brand: Threlaco,None,None,None,JYD-Threlaco-1987,None,$19.99,None,None,"['High Absorption Strength: the bilge socks are filled with high absorption poly mixture to selectively absorb oil; This strong absorption skillfully handles overflow, which helps to keep clean', 'Compact Size for Versatile Use: with dimensions of 5 x 16 inches/ 12 x 40 cm, these absorb socks can be placed in different positions; They can keep floors dry and clean in the cabin, or absorb grease and keep the water quality in the swimming pool', 'Strong Mesh: our bilge socks have a strong mesh outer sleeve that efficiently sheds water; This material is designed to be waterproof, but it performs well in oil absorption, ensuring that the blocked oil is fully absorbed, but does not absorb water', 'Easy to Replace: each package has two absorb socks, which are easy to change; Two bilge socks easily meet your replacement requirements', 'Widely Application: bilge socks have a wide range of uses; In addition to being ideal for absorbing oil in cabins, they can also absorb grease in swimming pools and other scenarios, helping to maintain clean water quality']",100,0%,0%,0%,0%
18.5 x 12.25 x 12.25 inches; 52 Pounds,B0CMZBHJGK,None,Prime Guard,Prime Guard Store,None,None,None,92006,None,$62.89,None,None,"['Removes Frost, Road Grime & Dirt', 'Effective to -20ºF', 'Leaves No Streak or Residue Behind']",0%,0%,0%,0%,0%
6.22 x 5.14 x 3.81 inches,B0DR5MQXMP,None,BL-J00891,Bulubiu Store,None,None,None,36410-60093 36410-60090,None,$67.86,None,None,"['【 Part Name 】Transmission Oil Fluid Cooler 19430-RCA-A51', '【Material of Parts】This product is made of high-quality material, which is wear-resistant and not easily damaged. The shell is sturdy, corrosion-resistant, responsive, stable in performance, reliable and durable, with a long service life', '【Quality Control】We will conduct multiple tests before shipment to ensure safety, stability, and durability, and package the items properly to ensure that the products are delivered to you in perfect condition', '【regular inspection】 Check the oil condition regularly to see if there is any deterioration, dirt or contamination and whether the oil needs to be replaced to ensure its cleanliness and good lubrication performance. If the oil cooler is found to be working abnormally (such as excessive oil temperature, oil leakage, etc.), it should be repaired in time at a professional maintenance agency to avoid more serious failures', '【 Friendly Reminder 】 Please confirm the part number/manufacturer/model/year before purchasing to ensure that the parts are suitable for your vehicle']",0%,0%,0%,0%,0%
0.13 x 0.13 x 0.1 inches,B0DQCT1PSK,None,ELECTRAPICK-09,ELECTRAPICK Store,None,None,None,TYR09,None,$13.99,None,None,"['【3-in-1 design】Hvac locking cap key comes with 410A, R22, universal 3-in-1 design and is compatible with various refrigerant locking caps on the refrigerant safety cover.', '【Durability】This hvac locking cap key is made of high quality galvanized iron and is designed to withstand frequent use and harsh operating conditions.The solid design can ensure the lasting performance and reliability.', '【Easy to use】Hvac key tool is designed to be small, hvac key tool for 410a and r22 refrigerants are easy to use in narrow spaces and angles.', '【Mountaineering Buckle】Refrigerant key for locking caps is equipped with a quick spring button, which can be easily hung on the waist, Hvac professionals can use at any time, and is also not easy to lose.', '【Essential for HVAC Professionals】This Hvac tool is an essential tool for hvac professionals. It is compatible with all Novent NG/NP/NPE Euro and NS universal locking caps.Tamper-proof locking caps (purchased separately) provide a unique way to prevent unauthorized access.']",0%,0%,0%,0%,0%
8.07 x 3.54 x 0.74 inches,B0DMRN3NG4,None,DXNQ-3880DA,Brand: DXNQ,None,None,None,DEF Antifreeze Coolant Refractometer,None,$15.99,None,None,"[""【Enhanced Clarity】: The refractometer features an optical glass prism that enhances clarity by 1.5 times, paired with a high light transmission rate. This allows for precise measurement of the freezing point of antifreeze, so you can make informed decisions about your car's cooling system."", ""【Durable Construction】: The refractometer's aluminum body is finished with chrome plating, offering high hardness, wear resistance, and protection against rust and corrosion. You can trust this long-lasting tool that withstands frequent exposure to automotive fluids."", '【Non-Slip Grip】: The tail section of the refractometer features a textured rubberized sleeve, which provides a comfortable and secure grip during operation. It allows for easy rotation and handling, minimizing the risk of slips that could compromise the accuracy of your readings.', '【Use Instructions】: First, open the daylight plate and clean the prism gently with a soft cloth. Second, add a few drops of the test fluid onto the prism and close the daylight plate to secure it. Next, look through the eyepiece, directing the prism toward a bright light source for visibility.', '【Broad Application】: This refractometer is ideal for various applications, including windshield washer fluid, antifreeze, diesel exhaust fluid (DEF), and electrolyte measurement, among others. You can refer to the measuring ranges listed below for some specific applications.']",0%,0%,0%,0%,0%
4.53 x 2.76 x 2.17 inches,B0DNVNKFRJ,None,ATFOEEN,Brand: ATFOEEN,None,None,None,None,None,$9.99,None,None,"['Replace Part Number: 904-964, 12608374. Please double-check whether the vehicle model is compatible with this product before purchase to avoid a mismatch', 'Compatible Model: The Intermediate Fuel Feed Pipe is compatible with Buick LaCrosse 2010-2016, Regal 2011-2017, Verano 2012-2017; for Chevy Captiva Sport 2011-2016, Equinox 2010-2017, Impala 2014, for Chevy Malibu 2013-2014, Orlando 2012-2014; for GMC Terrain 2010-2017.', 'Main Function: The high-pressure fuel pipeline provides the required amount of fuel to the engine, ensures the normal operation of the engine, and improves the sense of driving safety.', 'Hard Material: The fuel supply pipe is made of high-quality stainless steel material, durable, not easy to rust, long service life', 'Simple Installation: No technical expertise is required to install the fuel line, but tools are needed to remove the old part from the line and replace it with a new fuel line']",0%,0%,0%,0%,0%
4.96 x 3.07 x 0.63 inches; 2.1 ounces,B0DNJYQ1PZ,None,ECuoPix,Brand: ECuoPix,None,None,None,None,None,$8.99,None,None,"['[Complete Cleaning Kit for Precision Work] Upgrade your carburetor and torch maintenance with carb jet cleaning tool set; The set includes 3 tools kits for thorough, precise cleaning; carburetor jet cleaning tool ideal for professionals and DIY enthusiasts', '[Carburetor Cleaning Kit] This carburetor cleaning kit features 5 nylon brushes ranging from 3 to 7mm in diameter, and 10 cleaning wires from 0.4 to 1.3mm; Complete with a 4mm throttle wrench, carb cleaning kit is perfect for intricate carburetor tasks', '[Torch Tip Cleaner] Our torch tip cleaner set includes 13 precision needles ranging from 0.4mm to 1.6mm, and a flat file designed to tackle stubborn residues; This welding tip cleaner set ensures your torch runs smoothly much longer', '[Multipurpose Utility Tool] A sharp pick complements the airbrush cleaning kit set, ideal for hard-to-reach areas; Made from durable stainless steel, it provides longevity and reliability for various applications like stoves, burners, and more', '[Portable and Versatile] Compact and easy to carry, this carburetor jet cleaning tool set is a must-have for car, motorcycle, lawnmower, and other carburetor maintenance; Enhance your tool kit with these high-quality, versatile carb cleaning brushes']",0%,0%,0%,0%,0%
0.04 x 0.04 x 0.04 inches,B0DLNYQ9FW,None,LEKJL501BL-1026,Brand: lekudo,None,None,None,LEKJL501BL-4PS,None,$4.46,None,None,"['Packaging Details: You will receive 4 black automotive steering column gear rubber covers with an overall size of 1.14 "" x 0.35 "". Manufactured to original size specifications to ensure a precise fit without complicated changes.', 'Shock Absorption and Noise Reduction: The steering column gear sleeve is made of soft rubber material, which can effectively reduce the abnormal noise caused by gear friction and collision, providing smoother and quieter steering operation.', 'Elastic Recovery: The rubber sleeve has good elasticity and can withstand a certain amount of pressure and deformation during the steering process, and can quickly return to its original shape to maintain normal steering operations.', 'Wear Resistance and Durability: The rubber sleeve material has good wear resistance and can withstand long-term use and frequent steering operations, extending the service life of the steering column gear.', 'Applicable Models: This car steering column gear sleeve is compatible with 2007 2008 2009 2010 2011 2012 2013 2014 HYUNDAI Elantra, 2012 2013 2014 HYUNDAI Veloste, 2012 2013 2014 KIA Forte Sedan/Koup, 2012 2013 KIA Forte5.']",0%,0%,0%,0%,0%
